{
    "$id": "https://_schema.outv.im/info-pride/idols",
    "$schema": "http://json-schema.org/draft-07/schema",
    "description": "Idol data for wiki.biligame.com/idolypride",
    "required": [
        "长濑麻奈",
        "川咲樱",
        "一之濑怜",
        "佐伯遥子",
        "白石千纱",
        "兵藤雫",
        "长濑琴乃",
        "伊吹渚",
        "白石沙季",
        "成宫铃",
        "早坂芽衣",
        "天动瑠依",
        "铃村优",
        "奥山堇",
        "神崎莉央",
        "井川葵",
        "小美山爱",
        "赤崎心"
    ],
    "title": "The root schema",
    "type": "object",
    "properties": {
        "长濑麻奈": {
            "$ref": "#/$defs/idolInfo"
        },
        "川咲樱": {
            "$ref": "#/$defs/idolInfo"
        },
        "一之濑怜": {
            "$ref": "#/$defs/idolInfo"
        },
        "佐伯遥子": {
            "$ref": "#/$defs/idolInfo"
        },
        "白石千纱": {
            "$ref": "#/$defs/idolInfo"
        },
        "兵藤雫": {
            "$ref": "#/$defs/idolInfo"
        },
        "长濑琴乃": {
            "$ref": "#/$defs/idolInfo"
        },
        "伊吹渚": {
            "$ref": "#/$defs/idolInfo"
        },
        "白石沙季": {
            "$ref": "#/$defs/idolInfo"
        },
        "成宫铃": {
            "$ref": "#/$defs/idolInfo"
        },
        "早坂芽衣": {
            "$ref": "#/$defs/idolInfo"
        },
        "天动瑠依": {
            "$ref": "#/$defs/idolInfo"
        },
        "铃村优": {
            "$ref": "#/$defs/idolInfo"
        },
        "奥山堇": {
            "$ref": "#/$defs/idolInfo"
        },
        "神崎莉央": {
            "$ref": "#/$defs/idolInfo"
        },
        "井川葵": {
            "$ref": "#/$defs/idolInfo"
        },
        "小美山爱": {
            "$ref": "#/$defs/idolInfo"
        },
        "赤崎心": {
            "$ref": "#/$defs/idolInfo"
        }
    },
    "additionalProperties": false,
    "$defs": {
        "idolInfo": {
            "type": "object",
            "title": "Idol info",
            "description": "Information for an idol",
            "examples": [
                {
                    "nameJa": "長瀬琴乃",
                    "nameCn": "长濑琴乃",
                    "birthday": "12月25日",
                    "team": "月のテンペスト",
                    "cv": "橘美来",
                    "desc": "继承姐姐长濑麻奈的遗志，立志成为偶像的少女. \n在组合成立之初，也有刻意避开与人交流而喜欢独处的时候. 但最终在和成员一同跨越苦难的过程中，同大家一起成长，\n并且成为了能够引领大家的存在."
                }
            ],
            "properties": {
                "nameJa": {
                    "type": "string",
                    "title": "Name in Japanese",
                    "examples": [
                        "長瀬琴乃"
                    ]
                },
                "nameCn": {
                    "type": "string",
                    "title": "Name in Chinese",
                    "examples": [
                        "长濑琴乃"
                    ]
                },
                "birthday": {
                    "type": "string",
                    "examples": [
                        "12月25日"
                    ]
                },
                "team": {
                    "enum": [
                        "月のテンペスト",
                        "サニーピース",
                        "星见事务所",
                        "TRINITYAiLE",
                        "LizNoir"
                    ]
                },
                "cv": {
                    "type": "string",
                    "examples": [
                        "橘美来"
                    ]
                },
                "desc": {
                    "type": "string",
                    "title": "Description"
                }
            }
        }
    }
}